Enter password: *********
Welcome to the MySQL monitor.  Commands end with ; or \g.
Your MySQL connection id is 44
Server version: 8.0.32 MySQL Community Server - GPL

Copyright (c) 2000, 2023, Oracle and/or its affiliates.

Oracle is a registered trademark of Oracle Corporation and/or its
affiliates. Other names may be trademarks of their respective
owners.

Type 'help;' or '\h' for help. Type '\c' to clear the current input statement.

mysql> show databases
    -> show databases;
ERROR 1064 (42000): You have an error in your SQL syntax; check the manual that corresponds to your MySQL server version for the right syntax to use near 'show databases' at line 2
mysql> show databases;
+--------------------+
| Database           |
+--------------------+
| addressbook1       |
| information_schema |
| mysql              |
| payrollservice     |
| performance_schema |
| rfp255             |
| sakila             |
| sys                |
| test               |
| world              |
+--------------------+
10 rows in set (0.03 sec)

mysql> use payrollservice
Database changed
mysql> select * from employee_payroll;
+-------------+---------+----------+------------+
| employee_id | name    | salary   | start_date |
+-------------+---------+----------+------------+
|           1 | sudheer | 35000.00 | 2019-04-15 |
|           2 | sid     | 48000.00 | 2020-12-09 |
|           3 | madhu   |  5600.00 | 2022-04-25 |
+-------------+---------+----------+------------+
3 rows in set (0.01 sec)

mysql> select salary from employee_payroll where name='sid';
+----------+
| salary   |
+----------+
| 48000.00 |
+----------+
1 row in set (0.00 sec)

mysql> select * from employee_payroll WHERE start_date BETWEEN CAST('2019-04-15' AS DATE) AND DATE (NOW());
+-------------+---------+----------+------------+
| employee_id | name    | salary   | start_date |
+-------------+---------+----------+------------+
|           1 | sudheer | 35000.00 | 2019-04-15 |
|           2 | sid     | 48000.00 | 2020-12-09 |
|           3 | madhu   |  5600.00 | 2022-04-25 |
+-------------+---------+----------+------------+
3 rows in set (0.01 sec)

mysql> --------------------------------------
    -> alter table employee_payroll add gender varchar(5);
ERROR 1064 (42000): You have an error in your SQL syntax; check the manual that corresponds to your MySQL server version for the right syntax to use near '------------------------------------
alter table employee_payroll add gender var' at line 1
mysql> alter table employee_payroll add gender varchar(5);
Query OK, 0 rows affected (0.11 sec)
Records: 0  Duplicates: 0  Warnings: 0

mysql> select * from employee_payroll;
+-------------+---------+----------+------------+--------+
| employee_id | name    | salary   | start_date | gender |
+-------------+---------+----------+------------+--------+
|           1 | sudheer | 35000.00 | 2019-04-15 | NULL   |
|           2 | sid     | 48000.00 | 2020-12-09 | NULL   |
|           3 | madhu   |  5600.00 | 2022-04-25 | NULL   |
+-------------+---------+----------+------------+--------+
3 rows in set (0.00 sec)

mysql> update employee_payroll set gender = 'M' WHERE name = 'sudheer' or name = 'sid';
Query OK, 2 rows affected (0.01 sec)
Rows matched: 2  Changed: 2  Warnings: 0

mysql> select * from employee_payroll;
+-------------+---------+----------+------------+--------+
| employee_id | name    | salary   | start_date | gender |
+-------------+---------+----------+------------+--------+
|           1 | sudheer | 35000.00 | 2019-04-15 | M      |
|           2 | sid     | 48000.00 | 2020-12-09 | M      |
|           3 | madhu   |  5600.00 | 2022-04-25 | NULL   |
+-------------+---------+----------+------------+--------+
3 rows in set (0.00 sec)

mysql> update employee_payroll set gender = 'F' WHERE name = 'madhu';
Query OK, 1 row affected (0.00 sec)
Rows matched: 1  Changed: 1  Warnings: 0

mysql> select * from employee_payroll;
+-------------+---------+----------+------------+--------+
| employee_id | name    | salary   | start_date | gender |
+-------------+---------+----------+------------+--------+
|           1 | sudheer | 35000.00 | 2019-04-15 | M      |
|           2 | sid     | 48000.00 | 2020-12-09 | M      |
|           3 | madhu   |  5600.00 | 2022-04-25 | F      |
+-------------+---------+----------+------------+--------+
3 rows in set (0.00 sec)

mysql> SELECT SUM(salary) FROM employee_payroll
    ->  WHERE gender = 'F' GROUP BY gender;
+-------------+
| SUM(salary) |
+-------------+
|     5600.00 |
+-------------+
1 row in set (0.01 sec)

mysql> SELECT SUM(salary) FROM employee_payroll
    ->   WHERE gender = 'M' GROUP BY gender;
+-------------+
| SUM(salary) |
+-------------+
|    83000.00 |
+-------------+
1 row in set (0.00 sec)

mysql> SELECT AVG(salary) from employee_payroll
    ->  where gender = 'F' GROUP BY gender;
+-------------+
| AVG(salary) |
+-------------+
| 5600.000000 |
+-------------+
1 row in set (0.00 sec)

mysql> SELECT AVG(salary) from employee_payroll
    ->  where gender = 'M' GROUP BY gender;
+--------------+
| AVG(salary)  |
+--------------+
| 41500.000000 |
+--------------+
1 row in set (0.00 sec)

mysql> select min(salary) from employee_payroll
    ->  where gender = 'M' GROUP BY gender;
+-------------+
| min(salary) |
+-------------+
|    35000.00 |
+-------------+
1 row in set (0.00 sec)

mysql> select max(salary)  from employee_payroll
    ->  where gender = 'M' GROUP BY gender;
+-------------+
| max(salary) |
+-------------+
|    48000.00 |
+-------------+
1 row in set (0.00 sec)

mysql> alter table employee_payroll add (phone int(15), address varchar(20), department varchar(15));
Query OK, 0 rows affected, 1 warning (0.04 sec)
Records: 0  Duplicates: 0  Warnings: 1

mysql> describe employee_payroll;
+-------------+--------------+------+-----+---------+-------+
| Field       | Type         | Null | Key | Default | Extra |
+-------------+--------------+------+-----+---------+-------+
| employee_id | int          | NO   | PRI | NULL    |       |
| name        | varchar(30)  | YES  |     | NULL    |       |
| salary      | double(10,2) | YES  |     | NULL    |       |
| start_date  | date         | YES  |     | NULL    |       |
| gender      | varchar(5)   | YES  |     | NULL    |       |
| phone       | int          | YES  |     | NULL    |       |
| address     | varchar(20)  | YES  |     | NULL    |       |
| department  | varchar(15)  | YES  |     | NULL    |       |
+-------------+--------------+------+-----+---------+-------+
8 rows in set (0.01 sec)

mysql> alter table employee_payroll add (basic_pay double(10,3),deductions double(8,2), taxable_pay double(9,3), income_tax double(7,2), net_pay double(15,3));
Query OK, 0 rows affected, 5 warnings (0.05 sec)
Records: 0  Duplicates: 0  Warnings: 5

mysql> describe employee_payroll;
+-------------+--------------+------+-----+---------+-------+
| Field       | Type         | Null | Key | Default | Extra |
+-------------+--------------+------+-----+---------+-------+
| employee_id | int          | NO   | PRI | NULL    |       |
| name        | varchar(30)  | YES  |     | NULL    |       |
| salary      | double(10,2) | YES  |     | NULL    |       |
| start_date  | date         | YES  |     | NULL    |       |
| gender      | varchar(5)   | YES  |     | NULL    |       |
| phone       | int          | YES  |     | NULL    |       |
| address     | varchar(20)  | YES  |     | NULL    |       |
| department  | varchar(15)  | YES  |     | NULL    |       |
| basic_pay   | double(10,3) | YES  |     | NULL    |       |
| deductions  | double(8,2)  | YES  |     | NULL    |       |
| taxable_pay | double(9,3)  | YES  |     | NULL    |       |
| income_tax  | double(7,2)  | YES  |     | NULL    |       |
| net_pay     | double(15,3) | YES  |     | NULL    |       |
+-------------+--------------+------+-----+---------+-------+
13 rows in set (0.00 sec)

mysql>